{
  "$schema": "https://json-schema.org/draft/2020-12/schema",
  "type": "object",
  "additionalProperties": false,
  "required": ["id", "title", "task_ids", "decoder_ids", "shared_settings"],
  "properties": {
    "id": { "type": "string", "minLength": 1 },
    "title": { "type": "string", "minLength": 1 },
    "task_ids": {
      "type": "array",
      "minItems": 1,
      "items": { "type": "string", "minLength": 1 }
    },
    "decoder_ids": {
      "type": "array",
      "minItems": 1,
      "items": { "type": "string", "minLength": 1 }
    },
    "shared_settings": {
      "type": "object",
      "additionalProperties": {
        "anyOf": [
          { "type": "string" },
          { "type": "integer" },
          { "type": "number" },
          { "type": "boolean" },
          { "type": "null" }
        ]
      }
    }
  }
}
