{
  "id": "rotated-surface-baseline-v1",
  "title": "Rotated Surface Baseline v1",
  "task_ids": [
    "rotated-memory-z-cdep-v1"
  ],
  "decoder_ids": [
    "rmatching-default-v1",
    "rbposd-default-v1",
    "rbposd-osd0-v1",
    "rbposd-osd10-v1",
    "rilpqec-default-v1"
  ],
  "shared_settings": {
    "runner": "rsinter",
    "fixture_manifest": "benchmarks/fixtures/manifest.json"
  }
}
